query,keyword,response,category,intent,custom,language_code,trigger_intent,users_answer
"I-claim ang mga Bonus at Premyo","i-claim ang bonus, i-claim ang mga bonus, mga bonus, mga premyo, bonus na premyo, pag-claim ng bonus, i-claim ang premyo, i-claim ang mga premyo, i-claim ang mga promo, mga promo, promosyon, mga promosyon, promo, promo code, i-redeem ang bonus, i-redeem ang mga premyo, i-redeem ang promo, libreng bonus, libreng premyo, welcome bonus, araw-araw na bonus, i-claim na ang bonus, casino bonus, mga promo sa casino, alok na bonus, alok na promo, premyong bonus, bonus credits, libreng credits, libreng spins, spin bonus, cashback, rebate, reload bonus, deposit bonus, bonus na walang deposit, signup bonus, bonus sa pagrehistro, bonus sa unang deposit, VIP bonus, loyalty rewards, referral bonus, invite bonus, birthday bonus, espesyal na promo, limitadong promo, seasonal promo, promo sa event, bonus campaign, promo campaign, bonus code, coupon code, voucher code, redeem code, ilagay ang promo code, gamitin ang promo code, gamitin ang promo code, i-activate ang bonus, i-activate ang promo, i-unlock ang bonus, i-unlock ang premyo, kumuha ng bonus, kumuha ng mga premyo, kumuha ng promo, kumuha ng libreng bonus, kumuha ng libreng spins, kumuha ng cashback, paano mag-claim ng bonus, paano mag-claim ng mga premyo, paano mag-claim ng promo, paano mag-redeem ng bonus, paano mag-redeem ng mga premyo, paano gamitin ang promo code, paano makakuha ng bonus, paano ako mag-claim ng bonus, paano ako makakakuha ng bonus, paano ako makakapag-claim ng bonus, paano ako makakakuha ng mga premyo, mga hakbang sa pag-claim ng bonus, gabay sa bonus, gabay sa promo, gabay sa rewards, saan mag-claim ng bonus, saan ako makakapag-claim ng bonus, saan makukuha ang bonus, saan makukuha ang mga rewards, saan makukuha ang promo, paano i-claim ang bonus, paano i-claim ang rewards, paano i-claim ang promo, paano kunin ang bonus, paano kunin ang rewards, paano kunin ang promo, saan kukunin ang bonus, saan kukunin ang rewards, saan kukunin ang promo, paano makuha ang bonus, paano makuha ang rewards, paano makuha ang promo, paano makakuha ng libreng bonus, paano makakuha ng libreng spins, gusto kong kunin ang bonus, gusto kong i-claim ang bonus, gusto kong makuha ang rewards, gusto kong makuha ang promo, pahingi ng bonus, pahingi ng rewards, pahingi ng promo, may libreng bonus ba, may libreng rewards ba, may promo ba ngayon, may available bang bonus, may available bang rewards, may available bang promo, available ba ang bonus, available ba ang rewards, available ba ang promo, nasaan ang bonus, nasaan ang promo, nasaan ang rewards, pahina ng bonus, pahina ng promo, pahina ng rewards, gusto kong mag-claim ng bonus, gusto ko ng bonus, gusto ko ng rewards, gusto ko ng promo, kailangan ko ng bonus, kailangan ko ng rewards, kailangan ko ng promo, bigyan mo ako ng bonus, bigyan mo ako ng rewards, bigyan mo ako ng promo, pwede ba akong mag-claim ng bonus, pwede ba akong makakuha ng bonus, pwede ba akong makakuha ng rewards, pwede ko bang gamitin ang promo code, pwede ba akong mag-redeem ng bonus, available ang bonus, available ang promo, available ang rewards, may bonus ba, may promo ba, may rewards ba, tingnan ang bonus, tingnan ang rewards, tingnan ang promo, status ng bonus, status ng reward, status ng promo, pending ang bonus, hindi natanggap ang bonus, hindi natanggap ang reward, hindi gumagana ang promo, invalid na promo code, error sa bonus, issue sa reward, issue sa promo, mga requirement ng bonus, wagering requirement, turnover requirement, mga patakaran ng bonus, mga patakaran ng promo, mga patakaran ng rewards, i-claim na ang bonus, mag-redeem na ngayon, i-activate na ngayon, gamitin na ang code, mag-apply na ngayon,claim bonus, claim bonuses, bonuses, rewards, bonus reward, bonus claim, claim reward, claim rewards, claim promos, promos, promotion, promotions, promo, promo code, redeem bonus, redeem rewards, redeem promo, free bonus, free rewards, welcome bonus, daily bonus, bonus claim now, casino bonus, casino promos, bonus offer, promo offer, reward bonus, bonus credits, free credits, free spins, spin bonus, cashback, rebate, reload bonus, deposit bonus, no deposit bonus, signup bonus, registration bonus, first deposit bonus, vip bonus, loyalty rewards, referral bonus, invite bonus, birthday bonus, special promo, limited promo, seasonal promo, event promo, bonus campaign, promo campaign, bonus code, coupon code, voucher code, redeem code, enter promo code, apply promo code, use promo code, activate bonus, activate promo, unlock bonus, unlock reward, get bonus, get rewards, get promo, get free bonus, get free spins, get cashback, how to claim bonus, how to claim rewards, how to claim promo, how to redeem bonus, how to redeem rewards, how to use promo code, how to get bonus, how do i claim bonus, how do i get bonus, how can i claim bonus, how can i get rewards, steps to claim bonus, bonus guide, promo guide, rewards guide, where to claim bonus, where can i claim bonus, where is bonus, where is promo, where is rewards, bonus page, promo page, rewards page, i want to claim bonus, i want bonus, i want rewards, i want promo, i need bonus, i need rewards, i need promo, give me bonus, give me rewards, give me promo, can i claim bonus, can i get bonus, can i get rewards, can i use promo code, can i redeem bonus, bonus available, promo available, rewards available, is there bonus, is there promo, is there rewards, check bonus, check rewards, check promo, bonus status, reward status, promo status, bonus pending, bonus not received, reward not received, promo not working, invalid promo code, bonus error, reward issue, promo issue, bonus requirements, wagering requirement, turnover requirement, bonus rules, promo rules, rewards rules, claim bonus now, redeem now, activate now, use code now, apply now","<a href=""https://mcwphilippines.org/promotions/"">I-check ang aming latest Bonuses at Promotions sa MCW</a>",,,,en_US,,"a:8:{s:6:""answer"";a:0:{}s:8:""feedback"";a:0:{}s:9:""not_match"";s:0:"""";s:14:""trigger_intent"";s:0:"""";s:11:""entity_name"";s:0:"""";s:18:""entity_is_required"";i:0;s:13:""response_type"";i:2;s:14:""prompt_message"";s:0:"""";}"
"Paano mag-deposit","may isyu sa deposit, problema sa deposit, problema sa pagdeposito, mga problema sa deposit, hindi gumagana ang deposit, hindi makapagdeposito, hindi makapag-deposit, hindi makapaglagay ng pera, nabigong deposit, failed na deposit, error sa deposit, may error sa deposit, hindi pumapasok ang deposit, hindi natatanggap ang deposit, hindi na-credit ang pera, hindi na-credit ang pondo, hindi nag-uupdate ang balance pagkatapos magdeposito, delay sa deposit, delayed na deposit, pending ang deposit, bakit pending ang deposit ko, na-stuck ang deposit, na-stuck sa processing ang deposit, problema sa pagproseso ng deposit, oras ng pagproseso ng deposit, masyadong matagal ang deposit, gaano katagal ang deposit, hindi nagrereflect ang deposit, hindi lumalabas ang deposit, hindi lumalabas ang pera pagkatapos magdeposito, isyu sa GCash deposit, isyu sa Maya deposit, isyu sa e-wallet deposit, isyu sa bank deposit, failed na bank transfer, failed na GCash transfer, failed na Maya transfer, payment failed, hindi matagumpay ang bayad, error sa payment, transaction failed, error sa transaction, failed na deposit transaction, hindi nahanap ang transaction, isyu sa reference number, kulang o walang reference number, invalid na reference number, hindi nakumpirma ang deposit, hindi na-verify ang deposit, isyu sa verification ng deposit, problema sa account deposit, isyu sa deposit limit, isyu sa minimum deposit, isyu sa maximum deposit, may restriction sa deposit, na-block ang deposit, na-reject ang deposit, bakit na-reject ang deposit, bakit hindi gumagana ang deposit, hindi makapag-top up, isyu sa top up, failed na top up, hindi gumagana ang top up, isyu sa cash in, failed na cash in, hindi gumagana ang cash in, hindi gumagana ang GCash deposit, hindi gumagana ang Maya deposit, hindi gumagana ang bank deposit, isyu sa payment gateway, error sa payment system, banking error sa deposit, technical issue sa deposit, system error sa deposit, isyu sa site deposit, isyu sa app deposit, isyu sa mobile deposit, suporta sa deposit, tulong sa deposit, assistance sa deposit, kailangan ng tulong sa deposit, inquiry sa deposit, concern sa deposit, troubleshooting sa deposit, ayusin ang problema sa deposit, may isyu ako sa deposit, deposit, mga deposit, paano magdeposito, gumawa ng deposit, magdagdag ng pondo, pondohan ang account, mag-top up, mag-topup, magdagdag ng pera, magdeposito ng pera, cash in, pagbabayad, magbayad, paano magdagdag ng pera, magdeposito ngayon, proseso ng deposit, casino deposit, bank deposit, e-wallet deposit, GCash deposit, PayMaya deposit, Maya deposit, bKash deposit, Nagad deposit, Rocket deposit, crypto deposit, USDT deposit, BTC deposit, ETH deposit, card deposit, credit card deposit, debit card deposit, online banking deposit, instant deposit, mabilis na deposit, mabilis na top up, link ng deposit, pahina ng deposit, paraan ng deposit, mga opsyon sa deposit, mga tagubilin sa deposit, gabay sa deposit, tutorial sa deposit, mga hakbang sa pagdeposito, saan magdeposito, saan makakapagdeposito, nasaan ang opsyon sa deposit, paano magdeposito, paano makakapagdeposito, paano maglagay ng pera, paano magdagdag ng pondo, paano mag-top up, paano mag-cash in, gusto kong magdeposito, gusto kong magdagdag ng pera, gusto kong mag-top up, gusto kong mag-cash in, kailangan kong magdeposito, kailangan kong magdagdag ng pondo, kailangan kong mag-top up, pwede ba akong magdeposito, pwede ba akong magdagdag ng pera, pwede ba akong mag-top up, pwede ba akong mag-cash in, pwede ba akong mag-fund ng account, magdeposito ng pondo ngayon, magdagdag ng pondo ngayon, mag-top up ngayon, mag-cash in ngayon, magpadala ng pera, mag-transfer ng pera, magpadala ng pondo, magbayad, mag-proceed sa deposit, buksan ang pahina ng deposit, i-deposit sa account ko, magdagdag ng balance, dagdagan ang balance, i-refill ang account, i-reload ang account, i-load ang account, minimum na deposit, maximum na deposit, limit sa deposit, bayad sa deposit, singil sa deposit, deposit bonus, promo sa deposit, alok sa deposit, bonus sa unang deposit, deposit para sa bagong user, welcome bonus sa deposit, kumpirmasyon ng deposit, status ng deposit, pending na deposit, hindi natanggap ang deposit, isyu sa deposit, problema sa deposit, hindi na-reflect ang payment, hindi na-reflect ang cash in, hindi na-reflect ang top up, gaano katagal ang deposit, oras ng deposit, oras ng pagproseso ng deposit, kailan magre-reflect ang deposit, kailan maa-update ang balance, delay sa pagpasok ng deposit, beripikahin ang deposit, beripikasyon ng deposit, pag-upload ng resibo, patunay ng bayad, magpadala ng resibo, i-upload ang resibo, kumpirmahin ang deposit, manual na deposit, automatic na deposit, deposit via GCash, deposit via PayMaya, deposit via bank transfer, deposit via crypto, deposit via e-wallet,i have deposit issue, deposit issue, deposit problem, problems with deposit, deposit not working, cannot deposit, cant deposit, unable to deposit, failed deposit, deposit failed, deposit error, error on deposit, deposit not going through, deposit not received, money not credited, funds not credited, balance not updated after deposit, deposit delay, delayed deposit, deposit pending, pending deposit, why is my deposit pending, deposit stuck, deposit stuck in processing, deposit processing issue, deposit processing time, deposit taking too long, how long deposit takes, deposit not reflecting, deposit not showing, money not showing after deposit, gcash deposit issue, maya deposit issue, ewallet deposit issue, bank deposit issue, bank transfer failed, gcash transfer failed, maya transfer failed, payment failed, payment not successful, payment error, transaction failed, transaction error, deposit transaction failed, deposit transaction not found, reference number issue, missing reference number, invalid reference number, deposit not confirmed, deposit not verified, verification issue deposit, account deposit problem, deposit limit issue, minimum deposit issue, maximum deposit issue, deposit restrictions, deposit blocked, deposit declined, deposit rejected, why deposit rejected, why deposit failed, why deposit not working, unable to top up, top up issue, top up failed, top up not working, cash in issue, cashin issue, cash in failed, cash in not working, deposit via gcash not working, deposit via maya not working, deposit via bank not working, payment gateway issue, payment system error, banking error deposit, technical issue deposit, system error deposit, site deposit issue, app deposit issue, mobile deposit issue, deposit support, help with deposit, deposit assistance, need help deposit, deposit inquiry, deposit concern, deposit troubleshooting, fix deposit issue, resolve deposit problem , i have deposit issue, deposit, deposits, how to deposit, make deposit, add funds, fund account, top up, top-up, topup, add money, deposit money, cash in, cashin, payment, pay in, payin, how to add money, deposit now, deposit process, casino deposit, bank deposit, ewallet deposit, gcash deposit, paymaya deposit, maya deposit, bKash deposit, Nagad deposit, Rocket deposit, crypto deposit, usdt deposit, btc deposit, eth deposit, card deposit, credit card deposit, debit card deposit, online banking deposit, instant deposit, fast deposit, quick deposit, deposit link, deposit page, deposit method, deposit options, deposit instructions, deposit guide, deposit tutorial, steps to deposit, where to deposit, where can i deposit, where is deposit option, how do i deposit, how can i deposit, how to make a deposit, how to add funds, how to fund account, how to top up, how to topup, how to cash in, how to cashin, i want to deposit, i want to add money, i want to top up, i want to cash in, i need to deposit, i need to add funds, i need to top up, can i deposit, can i add money, can i top up, can i cash in, can i fund account, deposit funds now, add funds now, top up now, cash in now, send money, transfer money, transfer funds, send payment, make payment, pay now, proceed to deposit, open deposit page, deposit my account, add balance, increase balance, refill account, reload account, load account, minimum deposit, maximum deposit, deposit limit, deposit fee, deposit charges, deposit bonus, deposit promo, deposit offer, first deposit bonus, new user deposit, welcome bonus deposit, deposit confirmation, deposit status, deposit pending, deposit failed, deposit not received, deposit issue, deposit problem, payment failed, payment not reflected, cashin not reflected, topup not reflected, how long deposit, deposit time, deposit processing time, when will deposit reflect, when will balance update, delay in deposit, verify deposit, deposit verification, receipt upload, proof of payment, send receipt, upload receipt, confirm deposit, manual deposit, automatic deposit, deposit via gcash, deposit via paymaya, deposit via bank transfer, deposit via crypto, deposit via ewallet","<a href=""https://www.mcwguide.com/faq-category-ph/deposit-ph/?lang=ph"">Gabay sa Panimulang Deposit sa MCW</a>",,,,en_US,,"a:8:{s:6:""answer"";a:0:{}s:8:""feedback"";a:0:{}s:9:""not_match"";s:0:"""";s:14:""trigger_intent"";s:0:"""";s:11:""entity_name"";s:0:"""";s:18:""entity_is_required"";i:0;s:13:""response_type"";i:2;s:14:""prompt_message"";s:0:"""";}"
