query,keyword,response,category,intent,custom,language_code,trigger_intent,users_answer
"Paano Mag-withdraw","Paano mag-withdraw, paano maglabas ng pera, paano mag-cash out, paano mag-withdraw ng pera, paano mag-withdraw ng funds, paano i-withdraw ang pera, paano i-withdraw ang balance, paano mag-withdraw sa account, paano mag-withdraw sa wallet, paano mag-withdraw sa casino, paano mag-cash out ngayon, withdraw now, cash out now, withdrawal process, proseso ng withdrawal, steps sa pag-withdraw, mga hakbang sa pag-withdraw, withdrawal guide, gabay sa withdrawal, tutorial sa withdrawal, paano gawin ang withdrawal, saan mag-withdraw, saan makakapag-withdraw, nasaan ang withdraw option, where to withdraw, where is withdrawal option, withdrawal page, withdrawal section, withdrawal button, request withdrawal, mag-request ng withdrawal, withdrawal request, submit withdrawal, withdraw funds, withdraw money, cash out funds, cash out money, transfer to bank, bank withdrawal, e-wallet withdrawal, GCash withdrawal, Maya withdrawal, PayMaya withdrawal, bank transfer withdrawal, crypto withdrawal, USDT withdrawal, BTC withdrawal, ETH withdrawal, minimum withdrawal, maximum withdrawal, withdrawal limit, withdrawal fee, withdrawal charges, withdrawal time, processing time ng withdrawal, gaano katagal ang withdrawal, kailan darating ang withdrawal, withdrawal delay, delayed withdrawal, pending withdrawal, withdrawal pending, withdrawal failed, failed withdrawal, withdrawal error, error sa withdrawal, hindi makapag-withdraw, unable to withdraw, cannot withdraw, withdrawal issue, problema sa withdrawal, withdrawal problem, help with withdrawal, withdrawal support, withdrawal assistance, withdrawal inquiry, withdrawal not received, hindi natanggap ang withdrawal, hindi dumating ang pera, funds not received, money not credited, bank not credited, e-wallet not credited, withdrawal not reflected, hindi nag-reflect ang withdrawal, verification required withdrawal, withdrawal verification, KYC withdrawal, ID verification withdrawal, account verification withdrawal, withdrawal approval, withdrawal rejected, withdrawal declined, bakit na-reject ang withdrawal, bakit hindi pumasok ang withdrawal, bakit pending ang withdrawal, withdrawal status, check withdrawal status, track withdrawal, withdrawal tracking, withdraw funds now, cash out now, process withdrawal now, request cash out, i-withdraw na ngayon, mag-cash out na ngayon, claim withdrawal, release funds, fund release, payout, payout request, payout process, payout status, payout pending, payout failed, payout successful, mag-withdraw ng panalo, paano mag-withdraw ng panalo, mag-withdraw ng panalo, pag-withdraw ng panalo, i-withdraw ang aking panalo, i-cash out ang panalo, cashout ng panalo, cash out ng panalo, paano ko mawi-withdraw ang panalo, paano mag-cash out ng panalo, paano ko ma-ca-cashout ang panalo, pag-withdraw ng pera mula sa panalo, pag-withdraw ng pondo ng panalo, pag-withdraw ng kinita, cash out ng kita, cashout ng kita, paano mag-withdraw ng pera, paano ako makakapag-withdraw ng pera, paano ako magwi-withdraw ng pera, i-withdraw ang pera ko, i-cash out ang pera, cashout ng pera, mag-withdraw ng balanse, i-withdraw ang balanse ko, paano mag-withdraw ng balanse, pag-withdraw sa account, paano mag-withdraw mula sa account, i-withdraw mula sa aking account, ilipat ang panalo sa bangko, ilipat sa bank account, bank withdrawal, paano mag-withdraw sa bangko, GCash withdrawal, mag-withdraw via GCash, Maya withdrawal, mag-withdraw via Maya, e-wallet withdrawal, mag-withdraw sa e-wallet, payout ng panalo, paano kumuha ng payout, request ng withdrawal, humiling ng withdrawal, magsumite ng withdrawal, proseso ng withdrawal, mga hakbang sa withdrawal, mga hakbang sa pag-withdraw ng panalo, paano gumagana ang withdrawal, oras ng withdrawal, oras ng pagproseso ng withdrawal, gaano katagal ang withdrawal, pending ang withdrawal, status ng withdrawal, tingnan ang status ng withdrawal, bakit pending ang withdrawal, hindi natanggap ang withdrawal, hindi natanggap ang pera sa withdrawal, failed na withdrawal, nabigong withdrawal, na-reject ang withdrawal, problema sa withdrawal, paano ayusin ang problema sa withdrawal, minimum na withdrawal, limit sa withdrawal, maximum na withdrawal, mga requirement sa withdrawal, KYC sa withdrawal, pag-verify ng account para sa withdrawal, withdrawal verification, bayad sa withdrawal, fees sa withdrawal, may fee ba ang withdrawal, paano i-claim ang panalo, i-claim ang panalo, kolektahin ang panalo, i-redeem ang panalo, tanggapin ang panalo, paano makuha ang panalo, kunin ang panalo, kunin ang pera mula sa panalo, mag-withdraw ng kita, i-cash out ang kita, i-withdraw ang earnings, mag-withdraw ng earnings, i-withdraw ang pondo, mag-withdraw mula sa account, paano mag-withdraw ng pondo, pag-withdraw ng casino winnings, paano mag-cash out ng casino winnings, paano ako magwi-withdraw ng panalo, mag-withdraw, withdrawal, pag-withdraw, cash out, cashout, payout, payout request, withdrawal request, mag-request ng withdrawal, withdraw balance, kunin ang pera, kumuha ng pera, money withdrawal, casino withdrawal, mag-withdraw ng cash, mag-withdraw ng earnings, mag-withdraw ng kita, mag-withdraw ng premyo, mag-withdraw ng halaga, mag-withdraw ng pondo ngayon, mag-withdraw ngayon, instant withdrawal, mabilis na withdrawal, oras ng withdrawal, delay sa withdrawal, status ng withdrawal, pending withdrawal, failed withdrawal, hindi natanggap ang withdrawal, problema sa withdrawal, payout request, proseso ng payout, status ng payout, pending payout, failed payout, cashout request, proseso ng cashout, status ng cashout, pending cashout, failed cashout, paano mag-withdraw, paano mag-cash out, paano mag-cashout, paano mag-withdraw ng pera, paano mag-withdraw ng pondo, paano mag-withdraw ng panalo, paano mag-request ng withdrawal, paano gumawa ng withdrawal, paano mag-withdraw, paano mag-cash out, paano mag-cashout, mga hakbang sa pag-withdraw, gabay sa withdrawal, gabay sa cashout, gabay sa payout, instructions sa withdrawal, instructions sa cashout, instructions sa payout, saan mag-withdraw, saan makakapag-withdraw, nasaan ang option ng withdrawal, pahina ng withdrawal, pahina ng cashout, pahina ng payout, gusto kong mag-withdraw, gusto kong i-withdraw ang panalo ko, gusto kong mag-cash out, kailangan kong mag-withdraw, kailangan kong mag-cash out, bigyan mo ako ng pera ko, ipadala ang pera ko, ilabas ang pera ko, pwede ba akong mag-withdraw, pwede ba akong mag-cash out, pwede ko bang makuha ang pera ko, pwede ba akong mag-request ng withdrawal, i-withdraw ang pera ko, i-withdraw ang panalo ko, mag-withdraw lahat, buong balanse, partial withdrawal, full cashout, minimum withdrawal, maximum withdrawal, limit sa withdrawal, fee sa withdrawal, paraan ng withdrawal, mag-withdraw via GCash, mag-withdraw via bank, mag-withdraw via crypto, pag-verify ng withdrawal, mga dokumento sa withdrawal, KYC verification, approved na withdrawal, rejected na withdrawal, cancelled na withdrawal, completed na withdrawal, oras ng paglabas ng pera, gaano katagal ang cashout, kailan darating ang pera, delay sa payout, hindi natanggap ang payout, issue sa withdrawal, issue sa cashout, issue sa payout,how can i withdraw winnings, how to withdraw winnings, withdraw winnings, winnings withdrawal, withdraw my winnings, cash out winnings, cashout winnings, cash out my winnings, cashout my winnings, how do i withdraw winnings, how to cash out winnings, how do i cashout winnings, withdraw money winnings, withdraw funds winnings, withdraw earnings winnings, cash out earnings, cashout earnings, how to withdraw money, how can i withdraw money, how do i withdraw money, withdraw my money, cash out money, cashout money, withdraw balance, withdraw my balance, how to withdraw balance, account withdrawal, how to withdraw from account, withdraw from my account, transfer winnings to bank, transfer to bank account, bank withdrawal, how to withdraw to bank, gcash withdrawal, withdraw via gcash, maya withdrawal, withdraw via maya, ewallet withdrawal, withdraw to ewallet, payout winnings, how to get payout, payout request, request withdrawal, withdrawal request, submit withdrawal, withdrawal process, withdrawal steps, steps to withdraw winnings, how does withdrawal work, withdrawal time, withdrawal processing time, how long withdrawal takes, pending withdrawal, withdrawal pending, withdrawal status, check withdrawal status, why is my withdrawal pending, withdrawal not received, money not received withdrawal, failed withdrawal, withdrawal failed, rejected withdrawal, withdrawal rejected, cancelled withdrawal, withdrawal cancelled, withdrawal problem, withdrawal issue, withdrawal issues, how to fix withdrawal issue, minimum withdrawal, withdrawal limit, maximum withdrawal, withdrawal requirements, requirements for withdrawal, kyc withdrawal, account verification withdrawal, verify account for withdrawal, withdrawal verification, withdrawal fee, withdrawal charges, is there withdrawal fee, how to claim winnings, claim winnings, collect winnings, redeem winnings, receive winnings, how to receive winnings, get winnings, how to get my winnings, take out winnings, how to take out money winnings, withdraw profits, cash out profits, cashout profits, withdraw my earnings, how to withdraw earnings, withdraw funds from account, how to withdraw funds, withdraw casino winnings, how to cash out casino winnings , how can i withdraw winnings, withdraw, withdrawal, withdraw money, withdraw funds, withdraw winnings, cashout, cash out, payout, pay out, cash out winnings, cashout winnings, request withdrawal, withdrawal request, withdraw balance, take out money, get money, money withdrawal, casino withdrawal, withdraw cash, withdraw earnings, withdraw profit, withdraw prize, withdraw amount, withdraw funds now, withdraw now, instant withdrawal, fast withdrawal, withdrawal time, withdrawal delay, withdrawal status, withdrawal pending, withdrawal failed, withdrawal not received, withdrawal problem, payout request, payout processing, payout status, payout pending, payout failed, cashout request, cashout processing, cashout status, cashout pending, cashout failed, how to withdraw, how to cash out, how to cashout, how to withdraw money, how to withdraw funds, how to withdraw winnings, how to request withdrawal, how to make withdrawal, how do i withdraw, how do i cash out, how do i cashout, how can i withdraw, how can i cash out, how can i cashout, steps to withdraw, withdrawal guide, cashout guide, payout guide, withdraw instructions, cashout instructions, payout instructions, where to withdraw, where can i withdraw, where is withdrawal option, withdrawal page, cashout page, payout page, i want to withdraw, i want to withdraw money, i want to withdraw my winnings, i want to cash out, i want cashout, i need to withdraw, i need to cash out, i need payout, i want payout, i need my money, i want my money, i want my winnings, give me my winnings, send my money, release my money, can i withdraw, can i withdraw money, can i cash out, can i get my money, can i get payout, can i request withdrawal, withdraw my money, withdraw my winnings, withdraw all, withdraw full balance, withdraw partial, cash out my winnings, cash out all, payout my winnings, payout my balance, minimum withdrawal, maximum withdrawal, withdrawal limit, withdrawal fee, withdrawal charges, payout fee, cashout fee, withdrawal method, payout method, cashout method, withdraw via gcash, withdraw via bank, withdraw via crypto, withdraw via bKash, withdraw via Nagad, withdraw via Rocket, withdrawal verification, withdrawal requirements, withdrawal documents, withdrawal kyc, verify for withdrawal, withdrawal approved, withdrawal rejected, withdrawal cancelled, withdrawal completed, payout completed, cashout completed, withdrawal time frame, how long withdrawal, how long cashout, how long payout, when will i get my money, when will i receive payout, when will withdrawal arrive, delay in withdrawal, payout delay, cashout delay, no payout received, not received withdrawal, not received payout, withdraw issue, withdrawal issue, payout issue, cashout issue","<a href=""https://www.mcwguide.com/faq-category-ph/withdrawal-ph/?lang=ph"">Gabay sa Pag withdraw ng Iyong Winnings sa MCW</a>",,,,en_US,,"a:8:{s:6:""answer"";a:0:{}s:8:""feedback"";a:0:{}s:9:""not_match"";s:0:"""";s:14:""trigger_intent"";s:0:"""";s:11:""entity_name"";s:0:"""";s:18:""entity_is_required"";i:0;s:13:""response_type"";i:2;s:14:""prompt_message"";s:0:"""";}"
"I-download ang aming app","i-download ang app, idownload ang app, i download ang app, mag-download ng app, mag download ng app, i-download ang aming app, i download ang aming app, kunin ang app, mag-install ng app, mag install ng app, i-install ang app, i install ang app, mobile app, pag-download ng app, pag download ng app, apk, pag-download ng apk, pag download ng apk, ios app, android app, link ng app, paano mag-download, paano mag download, saan mag-download, saan mag download, i-install ngayon, i install ngayon, kunin ang app ngayon, buksan ang app, casino app download, opisyal na app, kunin ang mobile app, mag-download ngayon, mag download ngayon, mag-download ng latest na app, mag download ng latest na app, pinakabagong bersyon ng app, update ng app, i-update ang app, i update ang app, i-update ang apk, i update ang apk, download sa ios, download sa android, apk file, apk link, pinakabagong apk download, installer ng app, direct download, link ng download, url ng app, pahina ng download, kunin ang download link, ipadala ang app link, ibigay ang app link, link ng pag-download ng app, link ng pag download ng app, paano mag-install ng app, paano mag install ng app, paano mag-install ng apk, paano mag install ng apk, paano mag-install sa android, paano mag install sa android, paano mag-install sa ios, paano mag install sa ios, mga hakbang sa pag-download, mga hakbang sa pag download, mga hakbang sa pag-install, mga hakbang sa pag install, gabay sa pag-download, gabay sa pag download, gabay sa pag-install, gabay sa pag install, ipakita kung paano mag-download, ipakita kung paano mag download, ipakita ang app, pwede ba akong mag-download ng app, pwede ba akong mag download ng app, may app ba, may mobile app ba kayo, may android app ba, may ios app ba, available ba ang app, nasaan ang app link, ipadala ang app, ibigay ang app, gusto ko ang app, kailangan ko ang app, app pakiusap, link ng app, app pls, dl app, dl apk, apk pls, ios pls, android pls, app para sa iphone, app para sa android, download para sa iphone, download para sa android, mobile download, phone app, i-install ang app ngayon, i install ang app ngayon, kunin ang app link, paano kunin ang app, paano i-access ang app, paano i access ang app, buksan ang mobile app, maglaro gamit ang app, casino mobile app, betting app download, gaming app download, opisyal na download link, ligtas na download ng app, secure na pag-download ng app, download, download app, download our app, get app, install app, install, mobile app, app download, apk, download apk, ios app, android app, app link, how to download, where to download, install now, get the app now, open app, casino app download, official app, get the mobile app, install the app, download now, download latest app, latest version app, app update, update app, update apk, download ios, download android, ios download, android download, apk file, apk link, download apk latest, app installer, install apk, direct download, download link, app url, download page, get download link, send app link, give app link, app download link, how can i download, how do i download, where can i download, how to install app, how to install apk, how to install on android, how to install on ios, steps to download, steps to install, guide to download, guide to install, show me how to download, show me the app, can i download the app, is there an app, do you have app, do you have mobile app, is there android app, is there ios app, is app available, where is your app, where is app link, send me the app, give me the app, i want the app, i need the app, app please, link for app, app pls, dl app, dl apk, apk pls, ios pls, android pls, app for iphone, app for android, download for iphone, download for android, iphone app, android phone app, mobile download, phone app, install the app now, get the app link, can you send the app link, how to get the app, how to access the app, open mobile app, play via app, casino mobile app, betting app download, gaming app download, official download link, safe download app, secure app download","<a href=""https://www.mcwguide.com/app-download/?lang=ph&amp;utm_source=MCWAPPPHP"">I-download ang MCW App sa iyong phone</a>",,,,en_US,,"a:8:{s:6:""answer"";a:0:{}s:8:""feedback"";a:0:{}s:9:""not_match"";s:0:"""";s:14:""trigger_intent"";s:0:"""";s:11:""entity_name"";s:0:"""";s:18:""entity_is_required"";i:0;s:13:""response_type"";i:2;s:14:""prompt_message"";s:0:"""";}"
"FAQs — Mga Madalas Itanong","FAQs, mga madalas itanong, help, help center, support, customer support, customer service, assistance, mga tanong, karaniwang tanong, mga sagot, gabay, mga gabay, impormasyon, info, kailangan ng tulong, tulungan mo ako, troubleshooting, mga katanungan, inquiry, mga inquiry, query, mga query, paano ito gumagana, paano gumagana ito, matuto pa, support center, general na tanong, tulong sa account, tulong sa site, ano ito, ano ang site na ito, para saan ang site na ito, paano ito gumagana, paano ko ito gagamitin, paano ako magrerehistro, paano ako mag sign up, paano gumawa ng account, paano mag login, paano makipag ugnayan sa support, saan makakakuha ng tulong, nasaan ang FAQ, may support ba kayo, may customer service ba kayo, legit ba ito, ligtas ba ito, paano magsimula, faq, faqs, frequently asked questions, help, help center, support, customer support, customer service, assistance, questions, common questions, answers, guide, guides, information, info, need help, help me, troubleshooting, inquiries, query, queries, how it works, how does it work, learn more, support center, general questions, account help, site help, what is this, what is this site, what is your site about, how does this work, how do i use this, how can i register, how can i sign up, how do i create an account, how do i login, how do i contact support, where can i get help, where is the faq, do you have support, do you have customer service, is this legit, is this safe, how to get started","<a href=""https://www.mcwguide.com/faq-page/?lang=ph"">Mga Madalas Itanong (FAQs)</a>",,,,en_US,,"a:8:{s:6:""answer"";a:0:{}s:8:""feedback"";a:0:{}s:9:""not_match"";s:0:"""";s:14:""trigger_intent"";s:0:"""";s:11:""entity_name"";s:0:"""";s:18:""entity_is_required"";i:0;s:13:""response_type"";i:2;s:14:""prompt_message"";s:0:"""";}"
"Mga Nangungunang Brand","mga nangungunang brand, mga brand, aming mga brand, listahan ng brand, mga partner na brand, partner brands, pinagkakatiwalaang brand, pinakamahusay na brand, mga tampok na brand, mga sikat na brand, mga rekomendadong brand, gaming providers, game providers, software providers, listahan ng provider, mga provider, opisyal na partners, mga partner, casino brands, pagpili ng brand, pahina ng brand, tingnan ang mga brand, brand collaboration, mga sponsor, direktoryo ng brand, lahat ng brand, suportadong brand, available na brand, listahan ng partner, partner ng provider, gaming partners, software partners, casino providers, slots providers, live casino providers, sportsbook providers, mga pagpipilian ng brand, mga choice ng brand, i-explore ang mga brand, i-browse ang mga brand, ipakita ang mga brand, listahan ng mga brand, mga brand na available, mga brand na inaalok, anong mga brand ang mayroon kayo, anong mga brand ang available, pwede ko bang makita ang mga brand, ipakita ang mga partner na brand, sino ang mga provider ninyo, anong gaming providers ang ginagamit ninyo, anong software providers ang mayroon kayo, may providers ba kayo, may brand list ba kayo, may provider list ba kayo, saan makikita ang brand list, paano makita ang brands, gusto kong makita ang brands, gusto kong makita ang providers, ipakita ang provider list, ipakita ang brand list, ibigay ang provider list, ibigay ang brand list, Top Brands, mga nangungunang brand, top na brand, pinakamahusay na brand, mga kilalang brand, popular na brand, sikat na brand, trusted brands, pinagkakatiwalaang brand, leading brands, top companies, mga nangungunang kumpanya, top providers, mga top provider, top gaming brands, top casino brands, casino brands, gaming brands, sportsbook brands, betting brands, top operators, leading operators, best operators, recommended brands, featured brands, partner brands, official brands, premium brands, elite brands, top services, top sites, trusted sites, recommended sites, best sites, popular sites, top platforms, leading platforms, gaming platforms, betting platforms, casino platforms, sportsbook platforms, official partners, verified brands, legit brands, safe brands, top brands, brands, our brands, brand list, brand partners, partner brands, trusted brands, best brands, featured brands, popular brands, recommended brands, gaming providers, game providers, software providers, provider list, providers, official partners, partners, casino brands, brand selection, brand page, check brands, view brands, brand collaboration, sponsors, brand directory, all brands, supported brands, available brands, partner list, provider partners, gaming partners, software partners, casino providers, slots providers, live casino providers, sportsbook providers, brand options, brand choices, explore brands, browse brands, show brands, display brands, list brands, brands available, brands you offer, brands you support, what are your top brands, what are your brands, what brands do you have, what brands are available, which brands do you offer, can i see your brands, show me your brands, list of brands, what are your partner brands, who are your providers, what gaming providers do you use, what software providers do you have, which providers are available, which brands are available, which providers do you offer, what are your casino providers, what are your game providers, what are your software providers, do you have providers, do you have brands, do you support brands, is there a brand list, is there a provider list, where can i see brands, where is brand list, where is provider list, how to view brands, how to check brands, how to see providers, i want to see brands, i want to see providers, i want brand list, i want provider list, show provider list, show brand list, give me brand list, give me provider list, display provider list, display brand list, available providers, available partners, available brands list, supported providers, supported brands, official providers, official brands","<a href=""https://newcity.vip/ph/"">I-check ang iba pa naming iGaming Brands</a>",,,,en_US,,"a:8:{s:6:""answer"";a:0:{}s:8:""feedback"";a:0:{}s:9:""not_match"";s:0:"""";s:14:""trigger_intent"";s:0:"""";s:11:""entity_name"";s:0:"""";s:18:""entity_is_required"";i:0;s:13:""response_type"";i:2;s:14:""prompt_message"";s:0:"""";}"
