query,keyword,response,category,intent,custom,language_code,trigger_intent,users_answer
"Claim Bonuses & Rewards","claim bonus, claim bonuses, bonuses, rewards, bonus reward, bonus claim, claim reward, claim rewards, claim promos, promos, promotion, promotions, promo, promo code, redeem bonus, redeem rewards, redeem promo, free bonus, free rewards, welcome bonus, daily bonus, bonus claim now, casino bonus, casino promos, bonus offer, promo offer, reward bonus, bonus credits, free credits, free spins, spin bonus, cashback, rebate, reload bonus, deposit bonus, no deposit bonus, signup bonus, registration bonus, first deposit bonus, vip bonus, loyalty rewards, referral bonus, invite bonus, birthday bonus, special promo, limited promo, seasonal promo, event promo, bonus campaign, promo campaign, bonus code, coupon code, voucher code, redeem code, enter promo code, apply promo code, use promo code, activate bonus, activate promo, unlock bonus, unlock reward, get bonus, get rewards, get promo, get free bonus, get free spins, get cashback, how to claim bonus, how to claim rewards, how to claim promo, how to redeem bonus, how to redeem rewards, how to use promo code, how to get bonus, how do i claim bonus, how do i get bonus, how can i claim bonus, how can i get rewards, steps to claim bonus, bonus guide, promo guide, rewards guide, where to claim bonus, where can i claim bonus, where is bonus, where is promo, where is rewards, bonus page, promo page, rewards page, i want to claim bonus, i want bonus, i want rewards, i want promo, i need bonus, i need rewards, i need promo, give me bonus, give me rewards, give me promo, can i claim bonus, can i get bonus, can i get rewards, can i use promo code, can i redeem bonus, bonus available, promo available, rewards available, is there bonus, is there promo, is there rewards, check bonus, check rewards, check promo, bonus status, reward status, promo status, bonus pending, bonus not received, reward not received, promo not working, invalid promo code, bonus error, reward issue, promo issue, bonus requirements, wagering requirement, turnover requirement, bonus rules, promo rules, rewards rules, claim bonus now, redeem now, activate now, use code now, apply now","<a href=""https://banglaplus88.com/promotions/"">Banglaplus Latest Bonuses &amp; Promotions</a>",,,,en_US,,"a:8:{s:6:""answer"";a:0:{}s:8:""feedback"";a:0:{}s:9:""not_match"";s:0:"""";s:14:""trigger_intent"";s:0:"""";s:11:""entity_name"";s:0:"""";s:18:""entity_is_required"";i:0;s:13:""response_type"";i:2;s:14:""prompt_message"";s:0:"""";}"
"How to deposit","i have deposit issue, deposit issue, deposit problem, problems with deposit, deposit not working, cannot deposit, cant deposit, unable to deposit, failed deposit, deposit failed, deposit error, error on deposit, deposit not going through, deposit not received, money not credited, funds not credited, balance not updated after deposit, deposit delay, delayed deposit, deposit pending, pending deposit, why is my deposit pending, deposit stuck, deposit stuck in processing, deposit processing issue, deposit processing time, deposit taking too long, how long deposit takes, deposit not reflecting, deposit not showing, money not showing after deposit, gcash deposit issue, maya deposit issue, ewallet deposit issue, bank deposit issue, bank transfer failed, gcash transfer failed, maya transfer failed, payment failed, payment not successful, payment error, transaction failed, transaction error, deposit transaction failed, deposit transaction not found, reference number issue, missing reference number, invalid reference number, deposit not confirmed, deposit not verified, verification issue deposit, account deposit problem, deposit limit issue, minimum deposit issue, maximum deposit issue, deposit restrictions, deposit blocked, deposit declined, deposit rejected, why deposit rejected, why deposit failed, why deposit not working, unable to top up, top up issue, top up failed, top up not working, cash in issue, cashin issue, cash in failed, cash in not working, deposit via gcash not working, deposit via maya not working, deposit via bank not working, payment gateway issue, payment system error, banking error deposit, technical issue deposit, system error deposit, site deposit issue, app deposit issue, mobile deposit issue, deposit support, help with deposit, deposit assistance, need help deposit, deposit inquiry, deposit concern, deposit troubleshooting, fix deposit issue, resolve deposit problem , i have deposit issue, deposit, deposits, how to deposit, make deposit, add funds, fund account, top up, top-up, topup, add money, deposit money, cash in, cashin, payment, pay in, payin, how to add money, deposit now, deposit process, casino deposit, bank deposit, ewallet deposit, gcash deposit, paymaya deposit, maya deposit, bKash deposit, Nagad deposit, Rocket deposit, crypto deposit, usdt deposit, btc deposit, eth deposit, card deposit, credit card deposit, debit card deposit, online banking deposit, instant deposit, fast deposit, quick deposit, deposit link, deposit page, deposit method, deposit options, deposit instructions, deposit guide, deposit tutorial, steps to deposit, where to deposit, where can i deposit, where is deposit option, how do i deposit, how can i deposit, how to make a deposit, how to add funds, how to fund account, how to top up, how to topup, how to cash in, how to cashin, i want to deposit, i want to add money, i want to top up, i want to cash in, i need to deposit, i need to add funds, i need to top up, can i deposit, can i add money, can i top up, can i cash in, can i fund account, deposit funds now, add funds now, top up now, cash in now, send money, transfer money, transfer funds, send payment, make payment, pay now, proceed to deposit, open deposit page, deposit my account, add balance, increase balance, refill account, reload account, load account, minimum deposit, maximum deposit, deposit limit, deposit fee, deposit charges, deposit bonus, deposit promo, deposit offer, first deposit bonus, new user deposit, welcome bonus deposit, deposit confirmation, deposit status, deposit pending, deposit failed, deposit not received, deposit issue, deposit problem, payment failed, payment not reflected, cashin not reflected, topup not reflected, how long deposit, deposit time, deposit processing time, when will deposit reflect, when will balance update, delay in deposit, verify deposit, deposit verification, receipt upload, proof of payment, send receipt, upload receipt, confirm deposit, manual deposit, automatic deposit, deposit via gcash, deposit via paymaya, deposit via bank transfer, deposit via crypto, deposit via ewallet","<a href=""https://banglaplus88guide.com/faq-category/deposit/"">Banglaplus Deposit Guide</a>",,,,en_US,,"a:8:{s:6:""answer"";a:0:{}s:8:""feedback"";a:0:{}s:9:""not_match"";s:0:"""";s:14:""trigger_intent"";s:0:"""";s:11:""entity_name"";s:0:"""";s:18:""entity_is_required"";i:0;s:13:""response_type"";i:2;s:14:""prompt_message"";s:0:"""";}"
"How To Withdraw","how can i withdraw winnings, how to withdraw winnings, withdraw winnings, winnings withdrawal, withdraw my winnings, cash out winnings, cashout winnings, cash out my winnings, cashout my winnings, how do i withdraw winnings, how to cash out winnings, how do i cashout winnings, withdraw money winnings, withdraw funds winnings, withdraw earnings winnings, cash out earnings, cashout earnings, how to withdraw money, how can i withdraw money, how do i withdraw money, withdraw my money, cash out money, cashout money, withdraw balance, withdraw my balance, how to withdraw balance, account withdrawal, how to withdraw from account, withdraw from my account, transfer winnings to bank, transfer to bank account, bank withdrawal, how to withdraw to bank, gcash withdrawal, withdraw via gcash, maya withdrawal, withdraw via maya, ewallet withdrawal, withdraw to ewallet, payout winnings, how to get payout, payout request, request withdrawal, withdrawal request, submit withdrawal, withdrawal process, withdrawal steps, steps to withdraw winnings, how does withdrawal work, withdrawal time, withdrawal processing time, how long withdrawal takes, pending withdrawal, withdrawal pending, withdrawal status, check withdrawal status, why is my withdrawal pending, withdrawal not received, money not received withdrawal, failed withdrawal, withdrawal failed, rejected withdrawal, withdrawal rejected, cancelled withdrawal, withdrawal cancelled, withdrawal problem, withdrawal issue, withdrawal issues, how to fix withdrawal issue, minimum withdrawal, withdrawal limit, maximum withdrawal, withdrawal requirements, requirements for withdrawal, kyc withdrawal, account verification withdrawal, verify account for withdrawal, withdrawal verification, withdrawal fee, withdrawal charges, is there withdrawal fee, how to claim winnings, claim winnings, collect winnings, redeem winnings, receive winnings, how to receive winnings, get winnings, how to get my winnings, take out winnings, how to take out money winnings, withdraw profits, cash out profits, cashout profits, withdraw my earnings, how to withdraw earnings, withdraw funds from account, how to withdraw funds, withdraw casino winnings, how to cash out casino winnings , how can i withdraw winnings, withdraw, withdrawal, withdraw money, withdraw funds, withdraw winnings, cashout, cash out, payout, pay out, cash out winnings, cashout winnings, request withdrawal, withdrawal request, withdraw balance, take out money, get money, money withdrawal, casino withdrawal, withdraw cash, withdraw earnings, withdraw profit, withdraw prize, withdraw amount, withdraw funds now, withdraw now, instant withdrawal, fast withdrawal, withdrawal time, withdrawal delay, withdrawal status, withdrawal pending, withdrawal failed, withdrawal not received, withdrawal problem, payout request, payout processing, payout status, payout pending, payout failed, cashout request, cashout processing, cashout status, cashout pending, cashout failed, how to withdraw, how to cash out, how to cashout, how to withdraw money, how to withdraw funds, how to withdraw winnings, how to request withdrawal, how to make withdrawal, how do i withdraw, how do i cash out, how do i cashout, how can i withdraw, how can i cash out, how can i cashout, steps to withdraw, withdrawal guide, cashout guide, payout guide, withdraw instructions, cashout instructions, payout instructions, where to withdraw, where can i withdraw, where is withdrawal option, withdrawal page, cashout page, payout page, i want to withdraw, i want to withdraw money, i want to withdraw my winnings, i want to cash out, i want cashout, i need to withdraw, i need to cash out, i need payout, i want payout, i need my money, i want my money, i want my winnings, give me my winnings, send my money, release my money, can i withdraw, can i withdraw money, can i cash out, can i get my money, can i get payout, can i request withdrawal, withdraw my money, withdraw my winnings, withdraw all, withdraw full balance, withdraw partial, cash out my winnings, cash out all, payout my winnings, payout my balance, minimum withdrawal, maximum withdrawal, withdrawal limit, withdrawal fee, withdrawal charges, payout fee, cashout fee, withdrawal method, payout method, cashout method, withdraw via gcash, withdraw via bank, withdraw via crypto, withdraw via bKash, withdraw via Nagad, withdraw via Rocket, withdrawal verification, withdrawal requirements, withdrawal documents, withdrawal kyc, verify for withdrawal, withdrawal approved, withdrawal rejected, withdrawal cancelled, withdrawal completed, payout completed, cashout completed, withdrawal time frame, how long withdrawal, how long cashout, how long payout, when will i get my money, when will i receive payout, when will withdrawal arrive, delay in withdrawal, payout delay, cashout delay, no payout received, not received withdrawal, not received payout, withdraw issue, withdrawal issue, payout issue, cashout issue","<a href=""https://banglaplus88guide.com/faq-category/withdrawal/"">Banglaplus Withdrawal Guide</a>",,,,en_US,,"a:8:{s:6:""answer"";a:0:{}s:8:""feedback"";a:0:{}s:9:""not_match"";s:0:"""";s:14:""trigger_intent"";s:0:"""";s:11:""entity_name"";s:0:"""";s:18:""entity_is_required"";i:0;s:13:""response_type"";i:2;s:14:""prompt_message"";s:0:"""";}"
"Download Our App","download, download app, download our app, get app, install app, install, mobile app, app download, apk, download apk, ios app, android app, app link, how to download, where to download, install now, get the app now, open app, casino app download, official app, get the mobile app, install the app, download now, download latest app, latest version app, app update, update app, update apk, download ios, download android, ios download, android download, apk file, apk link, download apk latest, app installer, install apk, direct download, download link, app url, download page, get download link, send app link, give app link, app download link, how can i download, how do i download, where can i download, how to install app, how to install apk, how to install on android, how to install on ios, steps to download, steps to install, guide to download, guide to install, show me how to download, show me the app, can i download the app, is there an app, do you have app, do you have mobile app, is there android app, is there ios app, is app available, where is your app, where is app link, send me the app, give me the app, i want the app, i need the app, app please, link for app, app pls, dl app, dl apk, apk pls, ios pls, android pls, app for iphone, app for android, download for iphone, download for android, iphone app, android phone app, mobile download, phone app, install the app now, get the app link, can you send the app link, how to get the app, how to access the app, open mobile app, play via app, casino mobile app, betting app download, gaming app download, official download link, safe download app, secure app download","<a href=""https://banglaplus88guide.com/how-to-download-banglaplus-app/"">Download Banglaplus App</a>",,,,en_US,,"a:8:{s:6:""answer"";a:0:{}s:8:""feedback"";a:0:{}s:9:""not_match"";s:0:"""";s:14:""trigger_intent"";s:0:"""";s:11:""entity_name"";s:0:"""";s:18:""entity_is_required"";i:0;s:13:""response_type"";i:2;s:14:""prompt_message"";s:0:"""";}"
FAQs,"faq, faqs, frequently asked questions, help, help center, support, customer support, customer service, assistance, questions, common questions, answers, guide, guides, information, info, need help, help me, troubleshooting, inquiries, query, queries, how it works, how does it work, learn more, support center, general questions, account help, site help, what is this, what is this site, what is your site about, how does this work, how do i use this, how can i register, how can i sign up, how do i create an account, how do i login, how do i contact support, where can i get help, where is the faq, do you have support, do you have customer service, is this legit, is this safe, how to get started","<a href=""https://banglaplus88guide.com/faq-page/"">Banglaplus FAQs</a>",,,,en_US,,"a:8:{s:6:""answer"";a:0:{}s:8:""feedback"";a:0:{}s:9:""not_match"";s:0:"""";s:14:""trigger_intent"";s:0:"""";s:11:""entity_name"";s:0:"""";s:18:""entity_is_required"";i:0;s:13:""response_type"";i:2;s:14:""prompt_message"";s:0:"""";}"
"Top Brands","top brands, brands, our brands, brand list, brand partners, partner brands, trusted brands, best brands, featured brands, popular brands, recommended brands, gaming providers, game providers, software providers, provider list, providers, official partners, partners, casino brands, brand selection, brand page, check brands, view brands, brand collaboration, sponsors, brand directory, all brands, supported brands, available brands, partner list, provider partners, gaming partners, software partners, casino providers, slots providers, live casino providers, sportsbook providers, brand options, brand choices, explore brands, browse brands, show brands, display brands, list brands, brands available, brands you offer, brands you support, what are your top brands, what are your brands, what brands do you have, what brands are available, which brands do you offer, can i see your brands, show me your brands, list of brands, what are your partner brands, who are your providers, what gaming providers do you use, what software providers do you have, which providers are available, which brands are available, which providers do you offer, what are your casino providers, what are your game providers, what are your software providers, do you have providers, do you have brands, do you support brands, is there a brand list, is there a provider list, where can i see brands, where is brand list, where is provider list, how to view brands, how to check brands, how to see providers, i want to see brands, i want to see providers, i want brand list, i want provider list, show provider list, show brand list, give me brand list, give me provider list, display provider list, display brand list, available providers, available partners, available brands list, supported providers, supported brands, official providers, official brands","<a href=""https://newcity.vip/en/"">Check out our Topmost Brands here</a>",,,,en_US,,"a:8:{s:6:""answer"";a:0:{}s:8:""feedback"";a:0:{}s:9:""not_match"";s:0:"""";s:14:""trigger_intent"";s:0:"""";s:11:""entity_name"";s:0:"""";s:18:""entity_is_required"";i:0;s:13:""response_type"";i:2;s:14:""prompt_message"";s:0:"""";}"
"বোনাস ও পুরস্কার দাবি করুন","বোনাস দাবি করুন, বোনাসসমূহ দাবি করুন, বোনাসসমূহ, পুরস্কারসমূহ, বোনাস পুরস্কার, বোনাস দাবি, পুরস্কার দাবি করুন, পুরস্কারসমূহ দাবি করুন, প্রোমোশনসমূহ দাবি করুন, প্রোমোশনসমূহ, প্রোমোশন, প্রোমোশনসমূহ, প্রোমো, প্রোমো কোড, বোনাস রিডিম করুন, পুরস্কার রিডিম করুন, প্রোমো রিডিম করুন, ফ্রি বোনাস, ফ্রি পুরস্কার, স্বাগতম বোনাস, দৈনিক বোনাস, এখনই বোনাস দাবি করুন, ক্যাসিনো বোনাস, ক্যাসিনো প্রোমোশনসমূহ, বোনাস অফার, প্রোমো অফার, পুরস্কার বোনাস, বোনাস ক্রেডিট, ফ্রি ক্রেডিট, ফ্রি স্পিন, স্পিন বোনাস, ক্যাশব্যাক, রিবেট, রিলোড বোনাস, ডিপোজিট বোনাস, নো ডিপোজিট বোনাস, সাইনআপ বোনাস, রেজিস্ট্রেশন বোনাস, প্রথম ডিপোজিট বোনাস, ভিআইপি বোনাস, লয়্যালটি পুরস্কার, রেফারেল বোনাস, আমন্ত্রণ বোনাস, জন্মদিন বোনাস, বিশেষ প্রোমো, সীমিত প্রোমো, মৌসুমি প্রোমো, ইভেন্ট প্রোমো, বোনাস ক্যাম্পেইন, প্রোমো ক্যাম্পেইন, বোনাস কোড, কুপন কোড, ভাউচার কোড, কোড রিডিম করুন, প্রোমো কোড লিখুন, প্রোমো কোড প্রয়োগ করুন, প্রোমো কোড ব্যবহার করুন, বোনাস সক্রিয় করুন, প্রোমো সক্রিয় করুন, বোনাস আনলক করুন, পুরস্কার আনলক করুন, বোনাস পান, পুরস্কার পান, প্রোমো পান, ফ্রি বোনাস পান, ফ্রি স্পিন পান, ক্যাশব্যাক পান, কিভাবে বোনাস দাবি করবেন, কিভাবে পুরস্কার দাবি করবেন, কিভাবে প্রোমো দাবি করবেন, কিভাবে বোনাস রিডিম করবেন, কিভাবে পুরস্কার রিডিম করবেন, কিভাবে প্রোমো কোড ব্যবহার করবেন, কিভাবে বোনাস পাবেন, আমি কিভাবে বোনাস দাবি করবো, আমি কিভাবে বোনাস পাবো, আমি কিভাবে বোনাস দাবি করতে পারি, আমি কিভাবে পুরস্কার পেতে পারি, বোনাস দাবি করার ধাপসমূহ, বোনাস গাইড, প্রোমো গাইড, পুরস্কার গাইড, কোথায় বোনাস দাবি করবেন, আমি কোথায় বোনাস দাবি করতে পারি, বোনাস কোথায়, প্রোমো কোথায়, পুরস্কার কোথায়, বোনাস পেজ, প্রোমো পেজ, পুরস্কার পেজ, আমি বোনাস দাবি করতে চাই, আমি বোনাস চাই, আমি পুরস্কার চাই, আমি প্রোমো চাই, আমার বোনাস দরকার, আমার পুরস্কার দরকার, আমার প্রোমো দরকার, আমাকে বোনাস দিন, আমাকে পুরস্কার দিন, আমাকে প্রোমো দিন, আমি কি বোনাস দাবি করতে পারি, আমি কি বোনাস পেতে পারি, আমি কি পুরস্কার পেতে পারি, আমি কি প্রোমো কোড ব্যবহার করতে পারি, আমি কি বোনাস রিডিম করতে পারি, বোনাস উপলব্ধ, প্রোমো উপলব্ধ, পুরস্কার উপলব্ধ, কি বোনাস আছে, কি প্রোমো আছে, কি পুরস্কার আছে, বোনাস চেক করুন, পুরস্কার চেক করুন, প্রোমো চেক করুন, বোনাস স্ট্যাটাস, পুরস্কার স্ট্যাটাস, প্রোমো স্ট্যাটাস, বোনাস অপেক্ষমাণ, বোনাস পাওয়া যায়নি, পুরস্কার পাওয়া যায়নি, প্রোমো কাজ করছে না, অবৈধ প্রোমো কোড, বোনাস ত্রুটি, পুরস্কার সমস্যা, প্রোমো সমস্যা, বোনাসের শর্তাবলী, ওয়েজারিং শর্ত, টার্নওভার শর্ত, বোনাস নিয়মাবলী, প্রোমো নিয়মাবলী, পুরস্কার নিয়মাবলী, এখনই বোনাস দাবি করুন, এখনই রিডিম করুন, এখনই সক্রিয় করুন, এখনই কোড ব্যবহার করুন, এখনই প্রয়োগ করুন","<a href=""https://banglaplus88.com/bn/পরমশন/"">বাংলাপ্লাসের সর্বশেষ বোনাস ও প্রোমোশন</a>",,,,bn_BD,,"a:8:{s:6:""answer"";a:0:{}s:8:""feedback"";a:0:{}s:9:""not_match"";s:0:"""";s:14:""trigger_intent"";s:0:"""";s:11:""entity_name"";s:0:"""";s:18:""entity_is_required"";i:0;s:13:""response_type"";i:2;s:14:""prompt_message"";s:0:"""";}"
