query,keyword,response,category,intent,custom,language_code,trigger_intent,users_answer
"কিভাবে ডিপোজিট করবেন","আমার ডিপোজিট সমস্যা আছে, ডিপোজিট সমস্যা, ডিপোজিট সমস্যা, ডিপোজিট নিয়ে সমস্যা, ডিপোজিট কাজ করছে না, ডিপোজিট করতে পারছি না, ডিপোজিট করতে পারছি না, ডিপোজিট করতে অক্ষম, ডিপোজিট ব্যর্থ, ডিপোজিট ব্যর্থ হয়েছে, ডিপোজিট ত্রুটি, ডিপোজিটে ত্রুটি, ডিপোজিট সম্পন্ন হচ্ছে না, ডিপোজিট গ্রহণ করা হয়নি, টাকা জমা হয়নি, ফান্ড জমা হয়নি, ডিপোজিটের পরে ব্যালেন্স আপডেট হয়নি, ডিপোজিট দেরি, বিলম্বিত ডিপোজিট, ডিপোজিট পেন্ডিং, পেন্ডিং ডিপোজিট, আমার ডিপোজিট কেন পেন্ডিং, ডিপোজিট আটকে গেছে, ডিপোজিট প্রসেসিংয়ে আটকে আছে, ডিপোজিট প্রসেসিং সমস্যা, ডিপোজিট প্রসেসিং সময়, ডিপোজিট অনেক সময় নিচ্ছে, ডিপোজিট কতক্ষণ লাগে, ডিপোজিট দেখাচ্ছে না, ডিপোজিট প্রদর্শিত হচ্ছে না, ডিপোজিটের পর টাকা দেখাচ্ছে না, GCash ডিপোজিট সমস্যা, Maya ডিপোজিট সমস্যা, ই-ওয়ালেট ডিপোজিট সমস্যা, ব্যাংক ডিপোজিট সমস্যা, ব্যাংক ট্রান্সফার ব্যর্থ, GCash ট্রান্সফার ব্যর্থ, Maya ট্রান্সফার ব্যর্থ, পেমেন্ট ব্যর্থ, পেমেন্ট সফল হয়নি, পেমেন্ট ত্রুটি, ট্রানজ্যাকশন ব্যর্থ, ট্রানজ্যাকশন ত্রুটি, ডিপোজিট ট্রানজ্যাকশন ব্যর্থ, ডিপোজিট ট্রানজ্যাকশন পাওয়া যায়নি, রেফারেন্স নম্বর সমস্যা, রেফারেন্স নম্বর অনুপস্থিত, অবৈধ রেফারেন্স নম্বর, ডিপোজিট নিশ্চিত হয়নি, ডিপোজিট যাচাই হয়নি, ডিপোজিট ভেরিফিকেশন সমস্যা, অ্যাকাউন্ট ডিপোজিট সমস্যা, ডিপোজিট লিমিট সমস্যা, ন্যূনতম ডিপোজিট সমস্যা, সর্বোচ্চ ডিপোজিট সমস্যা, ডিপোজিট সীমাবদ্ধতা, ডিপোজিট ব্লক হয়েছে, ডিপোজিট বাতিল হয়েছে, ডিপোজিট প্রত্যাখ্যান হয়েছে, ডিপোজিট কেন প্রত্যাখ্যান হয়েছে, ডিপোজিট কেন ব্যর্থ হয়েছে, ডিপোজিট কেন কাজ করছে না, টপ আপ করতে পারছি না, টপ আপ সমস্যা, টপ আপ ব্যর্থ, টপ আপ কাজ করছে না, ক্যাশ ইন সমস্যা, ক্যাশ ইন সমস্যা, ক্যাশ ইন ব্যর্থ, ক্যাশ ইন কাজ করছে না, GCash এর মাধ্যমে ডিপোজিট কাজ করছে না, Maya এর মাধ্যমে ডিপোজিট কাজ করছে না, ব্যাংকের মাধ্যমে ডিপোজিট কাজ করছে না, পেমেন্ট গেটওয়ে সমস্যা, পেমেন্ট সিস্টেম ত্রুটি, ব্যাংকিং ত্রুটি ডিপোজিট, টেকনিক্যাল সমস্যা ডিপোজিট, সিস্টেম ত্রুটি ডিপোজিট, সাইট ডিপোজিট সমস্যা, অ্যাপ ডিপোজিট সমস্যা, মোবাইল ডিপোজিট সমস্যা, ডিপোজিট সাপোর্ট, ডিপোজিটে সাহায্য, ডিপোজিট সহায়তা, ডিপোজিটে সাহায্য দরকার, ডিপোজিট অনুসন্ধান, ডিপোজিট উদ্বেগ, ডিপোজিট সমস্যা সমাধান, ডিপোজিট সমস্যা ঠিক করুন, ডিপোজিট সমস্যা সমাধান করুন, আমার ডিপোজিট সমস্যা আছে, ডিপোজিট, ডিপোজিটসমূহ, কিভাবে ডিপোজিট করবেন, ডিপোজিট করুন, ফান্ড যোগ করুন, অ্যাকাউন্টে ফান্ড যোগ করুন, টপ আপ, টপ-আপ, টপআপ, টাকা যোগ করুন, টাকা জমা করুন, ক্যাশ ইন, ক্যাশ ইন, পেমেন্ট, পে ইন, পেই ইন, কিভাবে টাকা যোগ করবেন, এখনই ডিপোজিট, ডিপোজিট প্রক্রিয়া, ক্যাসিনো ডিপোজিট, ব্যাংক ডিপোজিট, ই-ওয়ালেট ডিপোজিট, GCash ডিপোজিট, PayMaya ডিপোজিট, Maya ডিপোজিট, bKash ডিপোজিট, Nagad ডিপোজিট, Rocket ডিপোজিট, ক্রিপ্টো ডিপোজিট, USDT ডিপোজিট, BTC ডিপোজিট, ETH ডিপোজিট, কার্ড ডিপোজিট, ক্রেডিট কার্ড ডিপোজিট, ডেবিট কার্ড ডিপোজিট, অনলাইন ব্যাংকিং ডিপোজিট, ইনস্ট্যান্ট ডিপোজিট, দ্রুত ডিপোজিট, দ্রুত ডিপোজিট, ডিপোজিট লিংক, ডিপোজিট পেজ, ডিপোজিট পদ্ধতি, ডিপোজিট অপশন, ডিপোজিট নির্দেশনা, ডিপোজিট গাইড, ডিপোজিট টিউটোরিয়াল, ডিপোজিট করার ধাপ, কোথায় ডিপোজিট করবেন, আমি কোথায় ডিপোজিট করতে পারি, ডিপোজিট অপশন কোথায়, আমি কিভাবে ডিপোজিট করব, কিভাবে ডিপোজিট করতে পারি, কিভাবে ডিপোজিট করবেন, কিভাবে ফান্ড যোগ করবেন, কিভাবে টপ আপ করবেন, কিভাবে ক্যাশ ইন করবেন, আমি ডিপোজিট করতে চাই, আমি টাকা যোগ করতে চাই, আমি টপ আপ করতে চাই, আমি ক্যাশ ইন করতে চাই, আমার ডিপোজিট দরকার, আমাকে ফান্ড যোগ করতে হবে, আমাকে টপ আপ করতে হবে, আমি কি ডিপোজিট করতে পারি, আমি কি টাকা যোগ করতে পারি, আমি কি টপ আপ করতে পারি, আমি কি ক্যাশ ইন করতে পারি, আমি কি অ্যাকাউন্টে ফান্ড যোগ করতে পারি, এখনই ফান্ড যোগ করুন, এখনই টাকা যোগ করুন, এখনই টপ আপ করুন, এখনই ক্যাশ ইন করুন, টাকা পাঠান, ফান্ড ট্রান্সফার করুন, টাকা ট্রান্সফার করুন, পেমেন্ট পাঠান, পেমেন্ট করুন, এখনই পেমেন্ট করুন, ডিপোজিটে যান, ডিপোজিট পেজ খুলুন, আমার অ্যাকাউন্টে ডিপোজিট করুন, ব্যালেন্স যোগ করুন, ব্যালেন্স বাড়ান, অ্যাকাউন্ট রিফিল করুন, অ্যাকাউন্ট রিলোড করুন, অ্যাকাউন্ট লোড করুন, ন্যূনতম ডিপোজিট, সর্বোচ্চ ডিপোজিট, ডিপোজিট লিমিট, ডিপোজিট ফি, ডিপোজিট চার্জ, ডিপোজিট বোনাস, ডিপোজিট প্রোমো, ডিপোজিট অফার, প্রথম ডিপোজিট বোনাস, নতুন ব্যবহারকারী ডিপোজিট, স্বাগতম বোনাস ডিপোজিট, ডিপোজিট নিশ্চিতকরণ, ডিপোজিট স্ট্যাটাস, ডিপোজিট পেন্ডিং, ডিপোজিট ব্যর্থ, ডিপোজিট গ্রহণ করা হয়নি, ডিপোজিট সমস্যা, ডিপোজিট সমস্যা, পেমেন্ট ব্যর্থ, পেমেন্ট দেখাচ্ছে না, ক্যাশ ইন দেখাচ্ছে না, টপ আপ দেখাচ্ছে না, ডিপোজিট কতক্ষণ লাগে, ডিপোজিট সময়, ডিপোজিট প্রসেসিং সময়, ডিপোজিট কখন দেখাবে, ব্যালেন্স কখন আপডেট হবে, ডিপোজিট দেরি, ডিপোজিট যাচাই, ডিপোজিট ভেরিফাই, রসিদ আপলোড, পেমেন্ট প্রমাণ, রসিদ পাঠান, রসিদ আপলোড করুন, ডিপোজিট নিশ্চিত করুন, ম্যানুয়াল ডিপোজিট, স্বয়ংক্রিয় ডিপোজিট, GCash এর মাধ্যমে ডিপোজিট, PayMaya এর মাধ্যমে ডিপোজিট, ব্যাংক ট্রান্সফারের মাধ্যমে ডিপোজিট, ক্রিপ্টোর মাধ্যমে ডিপোজিট, ই-ওয়ালেটের মাধ্যমে ডিপোজিট","<a href=""https://banglaplus88guide.com/bn/faq-category/deposit/"">বাংলাপ্লাস ডিপোজিট গাইড</a>",,,,bn_BD,,"a:8:{s:6:""answer"";a:0:{}s:8:""feedback"";a:0:{}s:9:""not_match"";s:0:"""";s:14:""trigger_intent"";s:0:"""";s:11:""entity_name"";s:0:"""";s:18:""entity_is_required"";i:0;s:13:""response_type"";i:2;s:14:""prompt_message"";s:0:"""";}"
"কিভাবে উত্তোলন করবেন","কিভাবে উইনিংস উত্তোলন করবেন, উইনিংস উত্তোলন, আমার উইনিংস উত্তোলন, উইনিংস ক্যাশ আউট, আমার উইনিংস ক্যাশ আউট, জেতা টাকা উত্তোলন, জেতা টাকা ক্যাশ আউট, উইনিংস উত্তোলন কিভাবে করবেন, কিভাবে উইনিংস ক্যাশ আউট করবেন, কিভাবে জেতা টাকা তুলবেন, কিভাবে টাকা উত্তোলন করবেন, আমার টাকা উত্তোলন, ক্যাশ আউট টাকা, টাকা ক্যাশ আউট, ব্যালেন্স উত্তোলন, আমার ব্যালেন্স উত্তোলন, অ্যাকাউন্ট থেকে টাকা উত্তোলন, অ্যাকাউন্ট থেকে উত্তোলন, ব্যাংকে টাকা ট্রান্সফার, ব্যাংক অ্যাকাউন্টে ট্রান্সফার, ব্যাংক উত্তোলন, ব্যাংকে উত্তোলন কিভাবে করবেন, GCash এর মাধ্যমে উত্তোলন, GCash থেকে উত্তোলন, Maya এর মাধ্যমে উত্তোলন, Maya থেকে উত্তোলন, ই-ওয়ালেট উত্তোলন, ই-ওয়ালেটে উত্তোলন, পেআউট অনুরোধ, উত্তোলনের অনুরোধ, উত্তোলন রিকোয়েস্ট জমা দিন, উত্তোলন প্রক্রিয়া, উত্তোলনের ধাপ, উত্তোলন কিভাবে কাজ করে, উত্তোলন সময়, উত্তোলন প্রসেসিং সময়, কতক্ষণ সময় লাগে উত্তোলন, পেন্ডিং উত্তোলন, উত্তোলন পেন্ডিং, উত্তোলনের স্ট্যাটাস, উত্তোলন স্ট্যাটাস চেক করুন, কেন উত্তোলন পেন্ডিং, উত্তোলন গ্রহণ করা হয়নি, টাকা পাওয়া যায়নি, উত্তোলন ব্যর্থ, উত্তোলন ফেইল হয়েছে, উত্তোলন প্রত্যাখ্যান, উত্তোলন বাতিল, উত্তোলন সমস্যা, উত্তোলনের সমস্যা, উত্তোলন ইস্যু, কিভাবে উত্তোলন সমস্যা ঠিক করবেন, ন্যূনতম উত্তোলন, সর্বোচ্চ উত্তোলন, উত্তোলন সীমা, উত্তোলনের শর্তাবলী, KYC উত্তোলন, অ্যাকাউন্ট যাচাই, উত্তোলন যাচাই, উত্তোলন ফি, উত্তোলন চার্জ, উইনিংস কিভাবে দাবি করবেন, উইনিংস দাবি করুন, উইনিংস সংগ্রহ করুন, উইনিংস রিডিম করুন, উইনিংস গ্রহণ করুন, কিভাবে উইনিংস পাবো, জেতা টাকা নেওয়া, প্রফিট উত্তোলন, লাভ ক্যাশ আউট, আমার আয় উত্তোলন, ফান্ড উত্তোলন, ক্যাসিনো উত্তোলন, এখনই উত্তোলন করুন, দ্রুত উত্তোলন, ইনস্ট্যান্ট উত্তোলন, উত্তোলন গাইড, ক্যাশ আউট গাইড, পেআউট গাইড, কোথায় উত্তোলন করবেন, উত্তোলন পেজ, উত্তোলন অপশন, আমি টাকা তুলতে চাই, আমি উইনিংস তুলতে চাই, আমি ক্যাশ আউট করতে চাই, আমাকে টাকা দিন, টাকা পাঠান, আমার টাকা দিন, কিভাবে উত্তোলন করবো, আমি কিভাবে উত্তোলন করতে পারি, আমি কিভাবে ক্যাশ আউট করবো, উত্তোলন অনুরোধ, উত্তোলন পদ্ধতি, উত্তোলন নিশ্চিতকরণ, উত্তোলন অনুমোদন, উত্তোলন সম্পন্ন, কতক্ষণ লাগে টাকা আসতে, কখন টাকা পাবো, উত্তোলন দেরি, টাকা না আসা, উত্তোলন সমস্যা সমাধান, পেআউট সমস্যা","<a href=""https://banglaplus88guide.com/bn/faq-category/widthdrawal/"">বাংলাপ্লাস উইথড্রয়াল গাইড</a>",,,,bn_BD,,"a:8:{s:6:""answer"";a:0:{}s:8:""feedback"";a:0:{}s:9:""not_match"";s:0:"""";s:14:""trigger_intent"";s:0:"""";s:11:""entity_name"";s:0:"""";s:18:""entity_is_required"";i:0;s:13:""response_type"";i:2;s:14:""prompt_message"";s:0:"""";}"
"আমাদের অ্যাপ ডাউনলোড করুন","অ্যাপ ডাউনলোড, অ্যাপ ডাউনলোড করুন, আমাদের অ্যাপ ডাউনলোড করুন, অ্যাপ নিন, অ্যাপ ইনস্টল করুন, ইনস্টল, মোবাইল অ্যাপ, অ্যাপ ডাউনলোড, APK, APK ডাউনলোড করুন, iOS অ্যাপ, Android অ্যাপ, অ্যাপ লিংক, কিভাবে ডাউনলোড করবেন, কোথায় ডাউনলোড করবেন, এখনই ইনস্টল করুন, এখনই অ্যাপ নিন, অ্যাপ খুলুন, ক্যাসিনো অ্যাপ ডাউনলোড, অফিসিয়াল অ্যাপ, মোবাইল অ্যাপ নিন, অ্যাপ ইনস্টল করুন, এখনই ডাউনলোড করুন, সর্বশেষ অ্যাপ ডাউনলোড, সর্বশেষ ভার্সন অ্যাপ, অ্যাপ আপডেট, অ্যাপ আপডেট করুন, APK ডাউনলোড করুন, iOS ডাউনলোড, Android ডাউনলোড, APK ফাইল, APK লিংক, সর্বশেষ APK ডাউনলোড, অ্যাপ ইনস্টলার, APK ইনস্টল করুন, সরাসরি ডাউনলোড, ডাউনলোড লিংক, অ্যাপ URL, ডাউনলোড পেজ, ডাউনলোড লিংক পান, অ্যাপ লিংক পাঠান, অ্যাপ লিংক দিন, অ্যাপ ডাউনলোড লিংক, কিভাবে ডাউনলোড করবো, কিভাবে ইনস্টল করবো, কিভাবে Android এ ইনস্টল করবেন, কিভাবে iOS এ ইনস্টল করবেন, ডাউনলোডের ধাপ, ইনস্টলের ধাপ, ডাউনলোড গাইড, ইনস্টল গাইড, আমাকে দেখান কিভাবে ডাউনলোড করবো, অ্যাপ দেখান, আমি কি অ্যাপ ডাউনলোড করতে পারি, কি অ্যাপ আছে, আপনার কি অ্যাপ আছে, মোবাইল অ্যাপ আছে কি, Android অ্যাপ আছে কি, iOS অ্যাপ আছে কি, অ্যাপ কি উপলব্ধ, আপনার অ্যাপ কোথায়, অ্যাপ লিংক কোথায়, আমাকে অ্যাপ পাঠান, অ্যাপ দিন, আমি অ্যাপ চাই, আমার অ্যাপ দরকার, অ্যাপ দয়া করে, অ্যাপ লিংক দিন, অ্যাপ প্লিজ, APK প্লিজ, iOS প্লিজ, Android প্লিজ, iPhone অ্যাপ, Android ফোন অ্যাপ, মোবাইল ডাউনলোড, ফোন অ্যাপ, এখনই অ্যাপ ইনস্টল করুন, অ্যাপ লিংক দিন, অ্যাপ কিভাবে পাবো, অ্যাপ কিভাবে অ্যাক্সেস করবো, মোবাইল অ্যাপ খুলুন, অ্যাপের মাধ্যমে খেলুন, ক্যাসিনো মোবাইল অ্যাপ, বেটিং অ্যাপ ডাউনলোড, গেমিং অ্যাপ ডাউনলোড, অফিসিয়াল ডাউনলোড লিংক, নিরাপদ অ্যাপ ডাউনলোড, সুরক্ষিত অ্যাপ ডাউনলোড","<section class=""text-token-text-primary w-full focus:outline-none [--shadow-height:45px] has-data-writing-block:pointer-events-none has-data-writing-block:-mt-(--shadow-height) has-data-writing-block:pt-(--shadow-height) [&amp;:has([data-writing-block])&gt;*]:pointer-events-auto R6Vx5W_threadScrollVars scroll-mb-[calc(var(--scroll-root-safe-area-inset-bottom,0px)+var(--thread-response-height))] scroll-mt-(--header-height)"" dir=""auto"" data-turn-id=""0d42d339-bfec-4d43-b4ba-0cafe52bdad1"" data-testid=""conversation-turn-171"" data-scroll-anchor=""false"" data-turn=""user""></section><a href=""https://banglaplus88guide.com/bn/how-to-download-banglaplus-app/"">বাংলাপ্লাস অ্যাপ ডাউনলোড করুন</a>

&nbsp;",,,,bn_BD,,"a:8:{s:6:""answer"";a:0:{}s:8:""feedback"";a:0:{}s:9:""not_match"";s:0:"""";s:14:""trigger_intent"";s:0:"""";s:11:""entity_name"";s:0:"""";s:18:""entity_is_required"";i:0;s:13:""response_type"";i:2;s:14:""prompt_message"";s:0:"""";}"
"প্রায়শই জিজ্ঞাসিত প্রশ্নাবলী","প্রশ্নোত্তর (FAQ), সাধারণ জিজ্ঞাসা, সাহায্য, সাহায্য কেন্দ্র, সাপোর্ট, কাস্টমার সাপোর্ট, কাস্টমার সার্ভিস, সহায়তা, প্রশ্নসমূহ, সাধারণ প্রশ্ন, উত্তরসমূহ, গাইড, নির্দেশিকা, তথ্য, দরকারি সাহায্য, আমাকে সাহায্য করুন, ট্রাবলশুটিং, জিজ্ঞাসা, কুয়েরি, এটি কিভাবে কাজ করে, আরও জানুন, সাপোর্ট সেন্টার, সাধারণ প্রশ্নাবলী, অ্যাকাউন্ট সাহায্য, সাইট সাহায্য, এটি কি, এই সাইট কি, আপনার সাইট সম্পর্কে কি, এটি কিভাবে কাজ করে, আমি কিভাবে ব্যবহার করবো, আমি কিভাবে রেজিস্টার করবো, আমি কিভাবে সাইন আপ করবো, আমি কিভাবে অ্যাকাউন্ট তৈরি করবো, আমি কিভাবে লগইন করবো, আমি কিভাবে সাপোর্টের সাথে যোগাযোগ করবো, কোথায় সাহায্য পাবো, FAQ কোথায়, আপনার কি সাপোর্ট আছে, আপনার কি কাস্টমার সার্ভিস আছে, এটা কি বৈধ, এটা কি নিরাপদ, কিভাবে শুরু করবো","<a href=""https://banglaplus88guide.com/bn/faq-page/"">বাংলাপ্লাস প্রায়শই জিজ্ঞাসিত প্রশ্নাবলী (FAQs)</a>",,,,bn_BD,,"a:8:{s:6:""answer"";a:0:{}s:8:""feedback"";a:0:{}s:9:""not_match"";s:0:"""";s:14:""trigger_intent"";s:0:"""";s:11:""entity_name"";s:0:"""";s:18:""entity_is_required"";i:0;s:13:""response_type"";i:2;s:14:""prompt_message"";s:0:"""";}"
